{
  "$schema": "https://json-schema.org/draft/2020-12/schema",
  "$id": "https://jovanipink.com/schemas/client-observations-v1.json",
  "title": "Cross-client skill observations",
  "type": "object",
  "required": [
    "$schema",
    "matrix_version",
    "catalog_version",
    "plugin_version",
    "tested_source_commit",
    "acceptance_status",
    "summary",
    "records"
  ],
  "properties": {
    "$schema": {"const": "./client-observations-schema.json"},
    "matrix_version": {"const": 1},
    "catalog_version": {"type": "string", "pattern": "^0\\.[1-9][0-9]*\\.0$"},
    "plugin_version": {"type": "string", "pattern": "^0\\.[1-9][0-9]*\\.0$"},
    "tested_source_commit": {"type": "string", "pattern": "^[0-9a-f]{40}$"},
    "acceptance_status": {"enum": ["accepted", "blocked"]},
    "summary": {
      "type": "object",
      "required": ["total", "pass", "fail", "blocked", "not_supported", "not_run"],
      "properties": {
        "total": {"type": "integer", "minimum": 1},
        "pass": {"type": "integer", "minimum": 0},
        "fail": {"type": "integer", "minimum": 0},
        "blocked": {"type": "integer", "minimum": 0},
        "not_supported": {"type": "integer", "minimum": 0},
        "not_run": {"type": "integer", "minimum": 0}
      },
      "additionalProperties": false
    },
    "records": {
      "type": "array",
      "minItems": 1,
      "items": {
        "type": "object",
        "required": [
          "case_id",
          "surface",
          "client_version",
          "client_build",
          "catalog_version",
          "plugin_version",
          "source_commit",
          "artifact",
          "package_sha256",
          "prompt",
          "expected_activation",
          "observed_activation",
          "resource_loading",
          "invocation_behavior",
          "output_summary",
          "result",
          "observed_at",
          "operator",
          "evidence_reference"
        ],
        "properties": {
          "case_id": {"type": "string", "pattern": "^[A-Z0-9-]+$"},
          "surface": {"enum": ["Codex CLI", "Codex Desktop", "Claude Code CLI", "Claude Code Desktop", "Claude.ai"]},
          "client_version": {"type": "string", "minLength": 1},
          "client_build": {"type": "string", "minLength": 1},
          "catalog_version": {"type": "string", "pattern": "^0\\.[1-9][0-9]*\\.0$"},
          "plugin_version": {"type": "string", "pattern": "^0\\.[1-9][0-9]*\\.0$"},
          "source_commit": {"type": "string", "pattern": "^[0-9a-f]{40}$"},
          "artifact": {"type": "string", "minLength": 1},
          "package_sha256": {"type": "string", "pattern": "^[0-9a-f]{64}$"},
          "prompt": {"type": "string", "minLength": 1},
          "expected_activation": {"enum": ["implicit", "explicit", "none", "not_applicable"]},
          "observed_activation": {"enum": ["activated", "not_activated", "not_applicable", "blocked"]},
          "resource_loading": {"enum": ["loaded", "not_loaded", "not_applicable", "blocked"]},
          "invocation_behavior": {"type": "string", "minLength": 1},
          "output_summary": {"type": "string", "minLength": 1},
          "result": {"enum": ["pass", "fail", "blocked", "not_supported", "not_run"]},
          "observed_at": {"type": "string", "pattern": "^\\d{4}-\\d{2}-\\d{2}T\\d{2}:\\d{2}:\\d{2}Z$"},
          "operator": {"type": "string", "minLength": 1},
          "evidence_reference": {"type": "string", "minLength": 1}
        },
        "additionalProperties": false
      }
    }
  },
  "additionalProperties": false
}
