{
  "$schema": "./client-observations-schema.json",
  "matrix_version": 1,
  "catalog_version": "0.3.0",
  "plugin_version": "0.3.0",
  "tested_source_commit": "8bd7c5d3f8497ad0207be31689e5a0198bbf2b7a",
  "acceptance_status": "blocked",
  "summary": {
    "total": 34,
    "pass": 0,
    "fail": 0,
    "blocked": 34,
    "not_supported": 0,
    "not_run": 0
  },
  "records": [
    {
      "case_id": "V03-CODEX-CLI-INSTALL",
      "surface": "Codex CLI",
      "client_version": "not observed in v0.3 release session",
      "client_build": "not observed in v0.3 release session",
      "catalog_version": "0.3.0",
      "plugin_version": "0.3.0",
      "source_commit": "8bd7c5d3f8497ad0207be31689e5a0198bbf2b7a",
      "artifact": "generated Codex engineering plugin tree",
      "package_sha256": "a35b3df97e957a13a6e7d4c8ef89aa139983200159f0997180ab79625f62206c",
      "prompt": "Install or upgrade the engineering and stack-profile plugins from the repository marketplace.",
      "expected_activation": "not_applicable",
      "observed_activation": "blocked",
      "resource_loading": "blocked",
      "invocation_behavior": "No fresh client session was authorized or available for this release observation.",
      "output_summary": "Blocked. No v0.3 client behavior or cross-surface parity is claimed.",
      "result": "blocked",
      "observed_at": "2026-08-21T06:30:00Z",
      "operator": "Jovani Pink with Codex",
      "evidence_reference": "v0.3 release-session boundary"
    },
    {
      "case_id": "V03-CODEX-CLI-ENGINEERING-DISCOVERY",
      "surface": "Codex CLI",
      "client_version": "not observed in v0.3 release session",
      "client_build": "not observed in v0.3 release session",
      "catalog_version": "0.3.0",
      "plugin_version": "0.3.0",
      "source_commit": "8bd7c5d3f8497ad0207be31689e5a0198bbf2b7a",
      "artifact": "generated Codex engineering plugin tree",
      "package_sha256": "a35b3df97e957a13a6e7d4c8ef89aa139983200159f0997180ab79625f62206c",
      "prompt": "Inspect the installed engineering quality skills.",
      "expected_activation": "not_applicable",
      "observed_activation": "blocked",
      "resource_loading": "blocked",
      "invocation_behavior": "No fresh client session was authorized or available for this release observation.",
      "output_summary": "Blocked. No v0.3 client behavior or cross-surface parity is claimed.",
      "result": "blocked",
      "observed_at": "2026-08-21T06:30:00Z",
      "operator": "Jovani Pink with Codex",
      "evidence_reference": "v0.3 release-session boundary"
    },
    {
      "case_id": "V03-CODEX-CLI-APPSEC-IMPLICIT",
      "surface": "Codex CLI",
      "client_version": "not observed in v0.3 release session",
      "client_build": "not observed in v0.3 release session",
      "catalog_version": "0.3.0",
      "plugin_version": "0.3.0",
      "source_commit": "8bd7c5d3f8497ad0207be31689e5a0198bbf2b7a",
      "artifact": "generated Codex engineering plugin tree",
      "package_sha256": "a35b3df97e957a13a6e7d4c8ef89aa139983200159f0997180ab79625f62206c",
      "prompt": "Review this application security design against current verification evidence.",
      "expected_activation": "implicit",
      "observed_activation": "blocked",
      "resource_loading": "blocked",
      "invocation_behavior": "No fresh client session was authorized or available for this release observation.",
      "output_summary": "Blocked. No v0.3 client behavior or cross-surface parity is claimed.",
      "result": "blocked",
      "observed_at": "2026-08-21T06:30:00Z",
      "operator": "Jovani Pink with Codex",
      "evidence_reference": "v0.3 release-session boundary"
    },
    {
      "case_id": "V03-CODEX-CLI-EXPLICIT-REFUSAL",
      "surface": "Codex CLI",
      "client_version": "not observed in v0.3 release session",
      "client_build": "not observed in v0.3 release session",
      "catalog_version": "0.3.0",
      "plugin_version": "0.3.0",
      "source_commit": "8bd7c5d3f8497ad0207be31689e5a0198bbf2b7a",
      "artifact": "generated Codex engineering plugin tree",
      "package_sha256": "a35b3df97e957a13a6e7d4c8ef89aa139983200159f0997180ab79625f62206c",
      "prompt": "Execute the approved plan, but do not invoke a named skill or perform changes.",
      "expected_activation": "none",
      "observed_activation": "blocked",
      "resource_loading": "blocked",
      "invocation_behavior": "No fresh client session was authorized or available for this release observation.",
      "output_summary": "Blocked. No v0.3 client behavior or cross-surface parity is claimed.",
      "result": "blocked",
      "observed_at": "2026-08-21T06:30:00Z",
      "operator": "Jovani Pink with Codex",
      "evidence_reference": "v0.3 release-session boundary"
    },
    {
      "case_id": "V03-CODEX-CLI-EXPLICIT-ACTIVATION",
      "surface": "Codex CLI",
      "client_version": "not observed in v0.3 release session",
      "client_build": "not observed in v0.3 release session",
      "catalog_version": "0.3.0",
      "plugin_version": "0.3.0",
      "source_commit": "8bd7c5d3f8497ad0207be31689e5a0198bbf2b7a",
      "artifact": "generated Codex engineering plugin tree",
      "package_sha256": "a35b3df97e957a13a6e7d4c8ef89aa139983200159f0997180ab79625f62206c",
      "prompt": "Use plan-execution for a read-only precondition check.",
      "expected_activation": "explicit",
      "observed_activation": "blocked",
      "resource_loading": "blocked",
      "invocation_behavior": "No fresh client session was authorized or available for this release observation.",
      "output_summary": "Blocked. No v0.3 client behavior or cross-surface parity is claimed.",
      "result": "blocked",
      "observed_at": "2026-08-21T06:30:00Z",
      "operator": "Jovani Pink with Codex",
      "evidence_reference": "v0.3 release-session boundary"
    },
    {
      "case_id": "V03-CODEX-CLI-PROFILE-DISCOVERY",
      "surface": "Codex CLI",
      "client_version": "not observed in v0.3 release session",
      "client_build": "not observed in v0.3 release session",
      "catalog_version": "0.3.0",
      "plugin_version": "0.3.0",
      "source_commit": "8bd7c5d3f8497ad0207be31689e5a0198bbf2b7a",
      "artifact": "generated Codex stack plugin tree",
      "package_sha256": "844878a90a51ffe5b204608f0f47a9758b174bbcb6ca5322f1977f6de3266b53",
      "prompt": "Inspect the installed stack profiles.",
      "expected_activation": "not_applicable",
      "observed_activation": "blocked",
      "resource_loading": "blocked",
      "invocation_behavior": "No fresh client session was authorized or available for this release observation.",
      "output_summary": "Blocked. No v0.3 client behavior or cross-surface parity is claimed.",
      "result": "blocked",
      "observed_at": "2026-08-21T06:30:00Z",
      "operator": "Jovani Pink with Codex",
      "evidence_reference": "v0.3 release-session boundary"
    },
    {
      "case_id": "V03-CODEX-CLI-PROFILE-REFERENCE",
      "surface": "Codex CLI",
      "client_version": "not observed in v0.3 release session",
      "client_build": "not observed in v0.3 release session",
      "catalog_version": "0.3.0",
      "plugin_version": "0.3.0",
      "source_commit": "8bd7c5d3f8497ad0207be31689e5a0198bbf2b7a",
      "artifact": "generated Codex stack plugin tree",
      "package_sha256": "844878a90a51ffe5b204608f0f47a9758b174bbcb6ca5322f1977f6de3266b53",
      "prompt": "Apply the Go profile and report the compatibility topics found only in its focused reference.",
      "expected_activation": "implicit",
      "observed_activation": "blocked",
      "resource_loading": "blocked",
      "invocation_behavior": "No fresh client session was authorized or available for this release observation.",
      "output_summary": "Blocked. No v0.3 client behavior or cross-surface parity is claimed.",
      "result": "blocked",
      "observed_at": "2026-08-21T06:30:00Z",
      "operator": "Jovani Pink with Codex",
      "evidence_reference": "v0.3 release-session boundary"
    },
    {
      "case_id": "V03-CODEX-CLI-UNINSTALL",
      "surface": "Codex CLI",
      "client_version": "not observed in v0.3 release session",
      "client_build": "not observed in v0.3 release session",
      "catalog_version": "0.3.0",
      "plugin_version": "0.3.0",
      "source_commit": "8bd7c5d3f8497ad0207be31689e5a0198bbf2b7a",
      "artifact": "generated Codex stack plugin tree",
      "package_sha256": "844878a90a51ffe5b204608f0f47a9758b174bbcb6ca5322f1977f6de3266b53",
      "prompt": "Uninstall both v0.3 plugins and verify discovery is removed.",
      "expected_activation": "not_applicable",
      "observed_activation": "blocked",
      "resource_loading": "blocked",
      "invocation_behavior": "No fresh client session was authorized or available for this release observation.",
      "output_summary": "Blocked. No v0.3 client behavior or cross-surface parity is claimed.",
      "result": "blocked",
      "observed_at": "2026-08-21T06:30:00Z",
      "operator": "Jovani Pink with Codex",
      "evidence_reference": "v0.3 release-session boundary"
    },
    {
      "case_id": "V03-CODEX-DESKTOP-ENGINEERING-DISCOVERY",
      "surface": "Codex Desktop",
      "client_version": "not observed in v0.3 release session",
      "client_build": "not observed in v0.3 release session",
      "catalog_version": "0.3.0",
      "plugin_version": "0.3.0",
      "source_commit": "8bd7c5d3f8497ad0207be31689e5a0198bbf2b7a",
      "artifact": "generated Codex engineering plugin tree",
      "package_sha256": "a35b3df97e957a13a6e7d4c8ef89aa139983200159f0997180ab79625f62206c",
      "prompt": "Inspect the installed engineering quality skills.",
      "expected_activation": "not_applicable",
      "observed_activation": "blocked",
      "resource_loading": "blocked",
      "invocation_behavior": "No fresh client session was authorized or available for this release observation.",